{
  "planId": "example-chart-001",
  "createdAt": "2025-07-01T11:00:00Z",
  "userRequest": "Create a bar chart of sales by region from the table in A1:C20",
  "summary": "Create a clustered bar chart from the sales data in A1:C20, titled 'Sales by Region'.",
  "steps": [
    {
      "id": "step_1",
      "description": "Read the sales data to verify structure",
      "action": "readRange",
      "params": {
        "range": "A1:C20",
        "includeHeaders": true
      }
    },
    {
      "id": "step_2",
      "description": "Create a clustered bar chart from the sales data",
      "action": "createChart",
      "params": {
        "dataRange": "A1:C20",
        "chartType": "bar",
        "title": "Sales by Region",
        "position": {
          "left": 350,
          "top": 10,
          "width": 500,
          "height": 350
        }
      },
      "dependsOn": ["step_1"]
    }
  ],
  "preserveFormatting": true,
  "confidence": 0.95,
  "warnings": []
}
